C16352,BLACK OR AFRICAN AMERICAN,Black or African American,,A person having origins in any of the black racial groups of Africa. Terms such as 'Haitian' or 'Negro' can be used in addition to 'Black or African American.' (FDA),
C41219,NATIVE HAWAIIAN OR OTHER PACIFIC ISLANDER,Native Hawaiian or Other Pacific Islander,,Denotes a person having origins in any of the original peoples of Hawaii,Guam,Samoa,or other Pacific Islands. The term covers particularly people who identify themselves as part-Hawaiian,Native Hawaiian,Guamanian or Chamorro,Carolinian,Samoan,Chuu. (FDA),
C41259,AMERICAN INDIAN OR ALASKA NATIVE,American Indian or Alaska Native,,A person having origins in any of the original peoples of North and South America (including Central America),and who maintains tribal affiliation or community attachment. (FDA),
C41261,WHITE,White,,Denotes a person with European,Middle Eastern,or North African ancestral origin who identifies,or is identified,as White. (FDA),
C41260,ASIAN,Asian,,A person having origins in any of the original peoples of the Far East,Southeast Asia,or the Indian subcontinent including,for example,Cambodia,China,India,Japan,Korea,Malaysia,Pakistan,the Philippine Islands,Thailand,and Vietnam. (FDA),
C74457,RACE,CDISC SDTM Race Terminology Race,Terminology codelist used to identify the race of an individual within the Clinical Data Interchange Standards Consortium Study Data Tabulation Model.,